{
  "$schema": "https://json-schema.org/draft/2020-12/schema",
  "$id": "https://samsarix.com/schemas/creative-spirals/plan-adapter-v2.schema.json",
  "title": "Samsarix Creative Spirals plan adapter payload",
  "description": "Deterministic publisher-neutral campaign-plan drafts for separately permissioned adapters.",
  "type": "object",
  "additionalProperties": false,
  "required": ["schemaVersion", "contract", "planId", "sourceHash", "name", "items"],
  "properties": {
    "schemaVersion": {"const": 2},
    "contract": {"const": "samsarix.plan-drafts"},
    "planId": {"type": "string", "pattern": "^scp_[0-9a-f]{12}$"},
    "sourceHash": {"type": "string", "pattern": "^[0-9a-f]{64}$"},
    "name": {"type": "string", "minLength": 1, "maxLength": 120},
    "items": {
      "type": "array",
      "minItems": 1,
      "maxItems": 100,
      "items": {
        "type": "object",
        "additionalProperties": false,
        "required": [
          "sequence",
          "source",
          "campaignId",
          "sourceHash",
          "intendedAt",
          "media",
          "drafts"
        ],
        "properties": {
          "sequence": {"type": "integer", "minimum": 1, "maximum": 100},
          "source": {"type": "string", "minLength": 1, "maxLength": 500},
          "campaignId": {"type": "string", "pattern": "^scs_[0-9a-f]{12}$"},
          "sourceHash": {"type": "string", "pattern": "^[0-9a-f]{64}$"},
          "intendedAt": {
            "type": ["string", "null"],
            "pattern": "^\\d{4}-\\d{2}-\\d{2}T\\d{2}:\\d{2}:\\d{2}(?:\\.\\d+)?Z$"
          },
          "media": {
            "type": "array",
            "maxItems": 20,
            "items": {"$ref": "#/$defs/mediaReference"}
          },
          "drafts": {
            "type": "array",
            "minItems": 1,
            "maxItems": 5,
            "items": {"$ref": "#/$defs/draft"}
          }
        }
      }
    }
  },
  "$defs": {
    "draft": {
      "type": "object",
      "additionalProperties": false,
      "required": [
        "platform",
        "content",
        "characterCount",
        "originalCharacterCount",
        "characterLimit",
        "truncated",
        "warnings",
        "media"
      ],
      "properties": {
        "platform": {"enum": ["x", "linkedin", "bluesky", "mastodon", "discord"]},
        "content": {"type": "string", "maxLength": 120000},
        "characterCount": {"type": "integer", "minimum": 0, "maximum": 100000},
        "originalCharacterCount": {"type": "integer", "minimum": 0, "maximum": 250000},
        "characterLimit": {"type": "integer", "minimum": 1, "maximum": 100000},
        "truncated": {"type": "boolean"},
        "warnings": {
          "type": "array",
          "maxItems": 10,
          "items": {"type": "string", "maxLength": 500}
        },
        "media": {
          "type": "array",
          "maxItems": 4,
          "items": {"$ref": "#/$defs/mediaAttachment"}
        }
      }
    },
    "mediaReference": {
      "type": "object",
      "additionalProperties": false,
      "required": ["path", "altText", "platforms"],
      "properties": {
        "path": {"$ref": "#/$defs/mediaPath"},
        "altText": {"$ref": "#/$defs/altText"},
        "platforms": {
          "type": "array",
          "minItems": 1,
          "maxItems": 5,
          "uniqueItems": true,
          "items": {"enum": ["x", "linkedin", "bluesky", "mastodon", "discord"]}
        }
      }
    },
    "mediaAttachment": {
      "type": "object",
      "additionalProperties": false,
      "required": ["path", "altText"],
      "properties": {
        "path": {"$ref": "#/$defs/mediaPath"},
        "altText": {"$ref": "#/$defs/altText"}
      }
    },
    "mediaPath": {
      "type": "string",
      "minLength": 1,
      "maxLength": 240,
      "pattern": "^(?!/)(?!.*(?:^|/)\\.{1,2}(?:/|$))[^\\\\:<>\"|?*\\u0000-\\u001F\\u007F-\\u009F]+\\.(?:[jJ][pP][eE]?[gG]|[pP][nN][gG])$"
    },
    "altText": {
      "type": "string",
      "minLength": 1,
      "maxLength": 1000,
      "pattern": "^[^\\u0000-\\u001F\\u007F-\\u009F]+$"
    }
  }
}
